{
  "schema_version": 1,
  "identity": {
    "slug": "fictional-sheets",
    "title": "虛構試算表實作課"
  },
  "governance": {
    "created_by": "課程團隊",
    "created_at": "2026-10-18T12:00:00+08:00",
    "approval_authority": "course-run-with-explicit-user-approval"
  },
  "gates": {
    "G0": {
      "status": "APPROVED",
      "owner": "course-run",
      "inputs": [],
      "deliverables": [],
      "evidence": [
        {
          "kind": "gate_submission",
          "actor": "course-run",
          "at": "2026-10-18T12:30:00+08:00"
        },
        {
          "kind": "user_approval",
          "approved_by": "使用者",
          "approved_at": "2026-10-18T12:40:00+08:00",
          "note": "核准虛構課程需求"
        }
      ],
      "risks": [],
      "open_questions": [],
      "approved_by": "使用者",
      "approved_at": "2026-10-18T12:40:00+08:00",
      "source_revision": 1,
      "affected_downstream": [
        "G1",
        "G2",
        "G3",
        "G4",
        "G5",
        "G6"
      ]
    },
    "G1": {
      "status": "APPROVED",
      "owner": "course-researcher",
      "inputs": [
        "G0"
      ],
      "deliverables": [
        {
          "id": "g1-research",
          "path": "evidence/g1-research.json"
        }
      ],
      "evidence": [
        {
          "kind": "gate_submission",
          "actor": "course-researcher",
          "at": "2026-10-18T14:30:00+08:00"
        },
        {
          "kind": "user_approval",
          "approved_by": "使用者",
          "approved_at": "2026-10-18T14:40:00+08:00",
          "note": "核准研究證據"
        }
      ],
      "risks": [],
      "open_questions": [],
      "approved_by": "使用者",
      "approved_at": "2026-10-18T14:40:00+08:00",
      "source_revision": 1,
      "affected_downstream": [
        "G2",
        "G3",
        "G4",
        "G5",
        "G6"
      ]
    },
    "G2": {
      "status": "APPROVED",
      "owner": "course-pm",
      "inputs": [
        "G0",
        "G1"
      ],
      "deliverables": [
        {
          "id": "g2-blueprint",
          "path": "evidence/g2-blueprint.md"
        }
      ],
      "evidence": [
        {
          "kind": "gate_submission",
          "actor": "course-pm",
          "at": "2026-10-18T15:30:00+08:00"
        },
        {
          "kind": "user_approval",
          "approved_by": "使用者",
          "approved_at": "2026-10-18T15:40:00+08:00",
          "note": "核准課程藍圖"
        }
      ],
      "risks": [],
      "open_questions": [],
      "approved_by": "使用者",
      "approved_at": "2026-10-18T15:40:00+08:00",
      "source_revision": 1,
      "affected_downstream": [
        "G3",
        "G4",
        "G5",
        "G6"
      ]
    },
    "G3": {
      "status": "DRAFT",
      "owner": "course-designer",
      "inputs": [
        "G0",
        "G1",
        "G2"
      ],
      "deliverables": [],
      "evidence": [],
      "risks": [],
      "open_questions": [],
      "approved_by": null,
      "approved_at": null,
      "source_revision": 0,
      "affected_downstream": [
        "G4",
        "G5",
        "G6"
      ]
    },
    "G4": {
      "status": "DRAFT",
      "owner": "build-course-page",
      "inputs": [
        "G0",
        "G1",
        "G2",
        "G3"
      ],
      "deliverables": [],
      "evidence": [],
      "risks": [],
      "open_questions": [],
      "approved_by": null,
      "approved_at": null,
      "source_revision": 0,
      "affected_downstream": [
        "G5",
        "G6"
      ]
    },
    "G5": {
      "status": "DRAFT",
      "owner": "course-run",
      "inputs": [
        "G0",
        "G1",
        "G2",
        "G3",
        "G4"
      ],
      "deliverables": [],
      "evidence": [],
      "risks": [],
      "open_questions": [],
      "approved_by": null,
      "approved_at": null,
      "source_revision": 0,
      "affected_downstream": [
        "G6"
      ]
    },
    "G6": {
      "status": "DRAFT",
      "owner": "course-ops",
      "inputs": [
        "G0",
        "G1",
        "G2",
        "G3",
        "G4",
        "G5"
      ],
      "deliverables": [],
      "evidence": [],
      "risks": [],
      "open_questions": [],
      "approved_by": null,
      "approved_at": null,
      "source_revision": 0,
      "affected_downstream": []
    }
  },
  "G0_requirements": {
    "learner_context": "學員是第一次使用試算表的門市主管，需要在瀏覽器中整理每週銷售，交付一份主管可追查的異常說明。",
    "observable_result": "一份含原始資料、彙整、異常證據與下一步的試算表",
    "duration": "6 hours",
    "constraints": [
      "公司電腦無安裝權",
      "Google Sheets 可用"
    ],
    "unknowns": []
  },
  "G1_research": {},
  "adaptation": {},
  "G2_architecture": {},
  "G3_lesson_design": {},
  "G4_pilot": {},
  "G5_production": {},
  "G6_release_maintenance": {},
  "changes": [],
  "evidence_index": []
}
